{
  "$schema": "http://json-schema.org/draft-07/schema#",
  "$id": "https://pentest-lyan/module.schema.json",
  "title": "modules/{module_id}.json",
  "type": "object",
  "additionalProperties": false,
  "required": [
    "module",
    "module_id",
    "url",
    "status",
    "features",
    "validation_results",
    "cross_role_verification"
  ],
  "properties": {
    "module": {
      "type": "string",
      "minLength": 1
    },
    "module_id": {
      "$ref": "common.schema.json#/definitions/module_id"
    },
    "url": {
      "$ref": "common.schema.json#/definitions/absolute_uri"
    },
    "status": {
      "type": "string",
      "enum": [
        "in_progress",
        "completed"
      ]
    },
    "features": {
      "type": "array",
      "items": {
        "$ref": "#/definitions/feature"
      }
    },
    "validation_results": {
      "type": "array",
      "items": {
        "$ref": "#/definitions/validation_result"
      }
    },
    "cross_role_verification": {
      "$ref": "#/definitions/cross_role_verification"
    }
  },
  "definitions": {
    "feature": {
      "type": "object",
      "additionalProperties": false,
      "required": [
        "feature_id",
        "name",
        "type",
        "url",
        "access_path",
        "threat_model",
        "coverage_note"
      ],
      "properties": {
        "feature_id": {
          "type": "string",
          "pattern": "^[a-z0-9_]+_[a-z0-9_]+_[0-9]{3}$"
        },
        "name": {
          "type": "string",
          "minLength": 1
        },
        "type": {
          "type": "string",
          "minLength": 1
        },
        "url": {
          "$ref": "common.schema.json#/definitions/absolute_uri"
        },
        "access_path": {
          "type": "array",
          "minItems": 1,
          "items": {
            "type": "object",
            "additionalProperties": false,
            "required": [
              "step",
              "action"
            ],
            "properties": {
              "step": {
                "type": "integer",
                "minimum": 1
              },
              "action": {
                "type": "string",
                "minLength": 1
              },
              "url": {
                "type": "string"
              }
            }
          }
        },
        "apis": {
          "type": "array",
          "items": {
            "type": "object",
            "additionalProperties": false,
            "required": [
              "url",
              "method"
            ],
            "properties": {
              "url": {
                "type": "string",
                "minLength": 1
              },
              "method": {
                "type": "string",
                "pattern": "^[A-Z]+$"
              },
              "params": {
                "type": "array",
                "items": {
                  "type": "string"
                }
              }
            }
          }
        },
        "threat_model": {
          "type": "array",
          "items": {
            "$ref": "#/definitions/threat"
          }
        },
        "coverage_note": {
          "type": "string",
          "minLength": 1,
          "description": "Answers to the three anti-omission questions: input surface, behavior surface, and depth surface. G2 requires a non-empty value."
        }
      }
    },
    "threat": {
      "type": "object",
      "additionalProperties": false,
      "required": [
        "threat_id",
        "vuln_type",
        "reasoning"
      ],
      "properties": {
        "threat_id": {
          "type": "string",
          "pattern": "^T[0-9]+$"
        },
        "vuln_type": {
          "type": "string",
          "minLength": 1
        },
        "reasoning": {
          "type": "string",
          "minLength": 1
        },
        "target_api": {
          "type": "string"
        },
        "target_params": {
          "type": "array",
          "items": {
            "type": "string"
          }
        }
      }
    },
    "validation_result": {
      "type": "object",
      "additionalProperties": false,
      "required": [
        "feature_id",
        "tests"
      ],
      "properties": {
        "feature_id": {
          "type": "string",
          "minLength": 1
        },
        "tests": {
          "type": "array",
          "items": {
            "$ref": "#/definitions/test"
          }
        }
      }
    },
    "test": {
      "type": "object",
      "additionalProperties": false,
      "required": [
        "threat_id",
        "vuln_type",
        "status"
      ],
      "properties": {
        "threat_id": {
          "type": "string",
          "pattern": "^T[0-9]+$"
        },
        "vuln_type": {
          "type": "string",
          "minLength": 1
        },
        "status": {
          "type": "string",
          "enum": [
            "confirmed",
            "impact_pending",
            "suspicious",
            "not_reproduced",
            "blocked"
          ]
        },
        "evidence_type": {
          "type": "string",
          "enum": [
            "api",
            "ui"
          ]
        },
        "access_path": {
          "type": "array",
          "minItems": 1
        },
        "evidence_refs": {
          "type": "array",
          "items": {
            "$ref": "evidence.schema.json"
          }
        },
        "session_pool_ref": {
          "type": "object",
          "additionalProperties": false,
          "properties": {
            "attacker": {
              "type": "string"
            },
            "victim": {
              "type": "string"
            }
          }
        },
        "notes": {
          "type": "string"
        },
        "missing_evidence": {
          "type": "array",
          "items": {
            "type": "string",
            "minLength": 1
          },
          "description": "Records exact missing proof for suspicious results or for a technically proven impact_pending result whose impact validation is structurally blocked."
        },
        "unruled_out": {
          "type": "string",
          "minLength": 1,
          "description": "Required when status=not_reproduced: list attack surfaces and residual uncertainty not yet excluded by current testing."
        },
        "blocker": {
          "$ref": "common.schema.json#/definitions/blocker"
        },
        "impact_validation": {
          "type": "object",
          "additionalProperties": false,
          "required": [
            "status",
            "technical_hit",
            "tested_dimensions",
            "next_steps"
          ],
          "properties": {
            "status": {
              "type": "string",
              "enum": [
                "in_progress",
                "blocked"
              ],
              "description": "in_progress must continue testing; blocked is allowed only after reasonable alternatives are exhausted and a structured blocker is recorded."
            },
            "technical_hit": {
              "type": "string",
              "minLength": 10,
              "description": "Observed technical boundary failure or successful PoC. This proves the issue exists but does not establish severity."
            },
            "tested_dimensions": {
              "type": "array",
              "minItems": 1,
              "uniqueItems": true,
              "items": {
                "type": "string",
                "enum": [
                  "identity",
                  "object",
                  "entry_point",
                  "state",
                  "request_shape",
                  "permissions",
                  "data_or_assets",
                  "business_result",
                  "affected_scope",
                  "scalability",
                  "prerequisites"
                ]
              }
            },
            "next_steps": {
              "type": "array",
              "minItems": 1,
              "items": {
                "type": "string",
                "minLength": 1
              },
              "description": "Concrete impact-validation actions still to execute, or the exact action needed to reopen a blocked impact-validation branch."
            }
          }
        }
      },
      "allOf": [
        {
          "if": {
            "properties": {
              "status": {
                "const": "not_reproduced"
              }
            },
            "required": [
              "status"
            ]
          },
          "then": {
            "required": [
              "unruled_out"
            ]
          }
        },
        {
          "if": {
            "properties": {
              "status": {
                "const": "impact_pending"
              }
            },
            "required": [
              "status"
            ]
          },
          "then": {
            "required": [
              "evidence_type",
              "access_path",
              "evidence_refs",
              "impact_validation"
            ],
            "properties": {
              "evidence_refs": {
                "minItems": 2,
                "allOf": [
                  {
                    "contains": {
                      "properties": {
                        "type": {
                          "const": "request"
                        }
                      },
                      "required": [
                        "type"
                      ]
                    }
                  },
                  {
                    "contains": {
                      "properties": {
                        "type": {
                          "const": "response"
                        }
                      },
                      "required": [
                        "type"
                      ]
                    }
                  }
                ]
              }
            }
          }
        },
        {
          "if": {
            "properties": {
              "status": {
                "const": "impact_pending"
              },
              "impact_validation": {
                "properties": {
                  "status": {
                    "const": "blocked"
                  }
                },
                "required": [
                  "status"
                ]
              }
            },
            "required": [
              "status",
              "impact_validation"
            ]
          },
          "then": {
            "required": [
              "notes",
              "missing_evidence",
              "blocker"
            ],
            "properties": {
              "notes": {
                "minLength": 1
              },
              "missing_evidence": {
                "minItems": 1
              }
            }
          }
        },
        {
          "if": {
            "properties": {
              "status": {
                "const": "confirmed"
              }
            },
            "required": [
              "status"
            ]
          },
          "then": {
            "required": [
              "evidence_type",
              "access_path",
              "evidence_refs"
            ],
            "properties": {
              "evidence_refs": {
                "minItems": 3,
                "allOf": [
                  {
                    "contains": {
                      "properties": {
                        "type": {
                          "const": "request"
                        }
                      },
                      "required": [
                        "type"
                      ]
                    }
                  },
                  {
                    "contains": {
                      "properties": {
                        "type": {
                          "const": "response"
                        }
                      },
                      "required": [
                        "type"
                      ]
                    }
                  },
                  {
                    "contains": {
                      "properties": {
                        "type": {
                          "const": "impact"
                        }
                      },
                      "required": [
                        "type"
                      ]
                    }
                  }
                ]
              }
            }
          }
        },
        {
          "if": {
            "properties": {
              "status": {
                "const": "suspicious"
              }
            },
            "required": [
              "status"
            ]
          },
          "then": {
            "required": [
              "missing_evidence"
            ],
            "properties": {
              "missing_evidence": {
                "minItems": 1
              }
            }
          }
        },
        {
          "if": {
            "properties": {
              "status": {
                "const": "blocked"
              }
            },
            "required": [
              "status"
            ]
          },
          "then": {
            "required": [
              "notes",
              "blocker"
            ],
            "properties": {
              "notes": {
                "minLength": 1
              }
            }
          }
        }
      ]
    },
    "cross_role_verification": {
      "type": "object",
      "additionalProperties": false,
      "required": [
        "tested",
        "test_time",
        "role_pairs_tested",
        "findings",
        "limitation"
      ],
      "properties": {
        "tested": {
          "type": "boolean"
        },
        "test_time": {
          "$ref": "common.schema.json#/definitions/date_time"
        },
        "role_pairs_tested": {
          "type": "array",
          "items": {
            "type": "object",
            "additionalProperties": false,
            "required": [
              "attacker",
              "victim",
              "pair_type"
            ],
            "properties": {
              "attacker": {
                "type": "string",
                "minLength": 1
              },
              "victim": {
                "type": "string",
                "minLength": 1
              },
              "pair_type": {
                "type": "string",
                "enum": [
                  "vertical",
                  "horizontal"
                ]
              }
            }
          }
        },
        "findings": {
          "type": "array"
        },
        "note": {
          "type": "string",
          "minLength": 1
        },
        "limitation": {
          "type": "string",
          "enum": [
            "none",
            "single_account",
            "no_account",
            "not_applicable"
          ],
          "description": "Explicit reason category for whether role-pair testing was fully available."
        }
      },
      "allOf": [
        {
          "if": {
            "properties": {
              "role_pairs_tested": {
                "maxItems": 0
              }
            },
            "required": [
              "role_pairs_tested"
            ]
          },
          "then": {
            "required": [
              "note"
            ]
          }
        }
      ]
    }
  }
}
