{
  "module": "Demo Module",
  "module_id": "demo",
  "url": "https://target.example.com/demo",
  "status": "completed",
  "features": [
    {
      "feature_id": "demo_feature_001",
      "name": "View Demo Object",
      "type": "detail",
      "url": "https://target.example.com/demo",
      "access_path": [
        {
          "step": 1,
          "action": "Log in"
        },
        {
          "step": 2,
          "action": "Open the demo page",
          "url": "https://target.example.com/demo"
        }
      ],
      "apis": [
        {
          "url": "https://target.example.com/api/demo",
          "method": "GET",
          "params": [
            "id"
          ]
        }
      ],
      "threat_model": [
        {
          "threat_id": "T1",
          "vuln_type": "Missing Object-Ownership Validation",
          "reasoning": "The client controls the object identifier",
          "target_api": "https://target.example.com/api/demo",
          "target_params": [
            "id"
          ]
        },
        {
          "threat_id": "T2",
          "vuln_type": "Parameter-Type Boundary",
          "reasoning": "The back end may parse arrays and strings through different code paths",
          "target_api": "https://target.example.com/api/demo",
          "target_params": [
            "id"
          ]
        }
      ],
      "coverage_note": "Input surface: tested object identifiers and type variants. Behavior surface: tested reads and cross-object access. Depth surface: reread the response to confirm the actual data boundary."
    }
  ],
  "validation_results": [
    {
      "feature_id": "demo_feature_001",
      "tests": [
        {
          "threat_id": "T1",
          "vuln_type": "Missing Object-Ownership Validation",
          "status": "confirmed",
          "evidence_type": "api",
          "access_path": [
            {
              "step": 1,
              "action": "Log in"
            },
            {
              "step": 2,
              "action": "Open the demo page",
              "url": "https://target.example.com/demo"
            }
          ],
          "evidence_refs": [
            {
              "evidence_id": "EV-demo-T1-request",
              "type": "request",
              "label": "attack",
              "path": "evidence/demo_feature_001/T1/attack-request.txt",
              "sha256": "sha256:716376a2aef43c0a4b4b28433cfd73ce2807dd58a0b9f75a955da1c32306f358"
            },
            {
              "evidence_id": "EV-demo-T1-response",
              "type": "response",
              "label": "attack",
              "path": "evidence/demo_feature_001/T1/attack-response.txt",
              "sha256": "sha256:beab83d87797c6e25308e39f4570202b12ef8e9ec6727a8a861718869592aa69"
            },
            {
              "evidence_id": "EV-demo-T1-impact",
              "type": "impact",
              "label": "verification",
              "path": "evidence/demo_feature_001/T1/impact-verification.json",
              "sha256": "sha256:f5076b70be26631aac59e42d36fb6c747e6930cecfa9be7230a2463b43a43215"
            }
          ],
          "notes": "Verified access to another test user's object"
        },
        {
          "threat_id": "T2",
          "vuln_type": "Parameter-Type Boundary",
          "status": "not_reproduced",
          "notes": "All currently reasonable type variants were rejected",
          "unruled_out": "Legacy compatibility endpoints and bulk entry points remain untested"
        }
      ]
    }
  ],
  "cross_role_verification": {
    "tested": true,
    "test_time": "2026-07-12T10:30:00+08:00",
    "role_pairs_tested": [],
    "findings": [],
    "note": "The test fixture contains only one account",
    "limitation": "single_account"
  }
}
